{
  "context_manifest_version": "0.3.0",
  "context_id": "cd20b84c944e1632",
  "role": "subject_candidate",
  "project": "ai_os",
  "source_revision": "0b1ce29386342ef4e1884d8a58b574445572575e",
  "candidate_patch_hash": "c88596959994f4aeca3a079156080475c28d40ed10b6fc05bbf31a69d37d4976",
  "ordered_sources": [
    {
      "path": "ROUTING_RULES.md",
      "canonical_owner": "inbox_router",
      "purpose": "canonical routing/tie-break rules",
      "content_hash": "e157237d3720ec7e6b2cfd3b8a0d91eab88a2502a438424d288f50dd8c67cd57",
      "bytes": 2596,
      "inclusion_reason": "canonical routing table, present exactly once",
      "source_class": "canonical_routing"
    },
    {
      "path": "ChatGPT/[AI OS]/PROJECT_INSTRUCTIONS.md",
      "canonical_owner": "ai_os",
      "purpose": "declared context entrypoint",
      "content_hash": "20c9a7ede6bd363ff8b36ee4c7ac5d4fd1cfde5a44551c6ceabf598e5cc90464",
      "bytes": 10369,
      "inclusion_reason": "PROJECT_CAPABILITIES.yaml context_entrypoints",
      "source_class": "project_instructions"
    },
    {
      "path": "ChatGPT/[AI OS]/Knowledge/AI_OS_PROJECT_FILES_INDEX.md",
      "canonical_owner": "ai_os",
      "purpose": "declared context entrypoint",
      "content_hash": "b22dbbb5c3fa94bde1c15664c379612e0df275f8db3fa1ca187a7966785e0a62",
      "bytes": 8803,
      "inclusion_reason": "PROJECT_CAPABILITIES.yaml context_entrypoints",
      "source_class": "governed_knowledge_bundle"
    },
    {
      "path": "ChatGPT/[AI OS]/Knowledge/PROJECT_ROUTING.md",
      "canonical_owner": "ai_os",
      "purpose": "named as required behavior check in PROJECT_INSTRUCTIONS.md #2",
      "content_hash": "a2c731e36ee21f414be74082c70113d101393660b530a9456738147f07da85ea",
      "bytes": 2143,
      "inclusion_reason": "PROJECT_CAPABILITIES.yaml required_knowledge (delivery=bundle)",
      "source_class": "governed_knowledge_bundle"
    },
    {
      "path": "ChatGPT/[AI OS]/Knowledge/GOVERNANCE_RULES.md",
      "canonical_owner": "ai_os",
      "purpose": "named as required behavior check in PROJECT_INSTRUCTIONS.md #2",
      "content_hash": "73a2f6ca12f511bacd26d8aaf5556879c84cb3bb5aa8c5aea1142ef3497cdcb5",
      "bytes": 3731,
      "inclusion_reason": "PROJECT_CAPABILITIES.yaml required_knowledge (delivery=bundle)",
      "source_class": "governed_knowledge_bundle"
    },
    {
      "path": "ChatGPT/[AI OS]/Knowledge/AI_OS_WORKFLOW.md",
      "canonical_owner": "ai_os",
      "purpose": "named as required behavior check in PROJECT_INSTRUCTIONS.md #2",
      "content_hash": "420ea4edaf6463b127a20ea4a1df602f82c05fd9b46e0e1df67250533ae7018d",
      "bytes": 2908,
      "inclusion_reason": "PROJECT_CAPABILITIES.yaml required_knowledge (delivery=bundle)",
      "source_class": "governed_knowledge_bundle"
    },
    {
      "path": "ChatGPT/[AI OS]/Knowledge/HANDOFF_PROTOCOL.md",
      "canonical_owner": "ai_os",
      "purpose": "named as required behavior check in PROJECT_INSTRUCTIONS.md #2",
      "content_hash": "63fc8bc23b00797d67addba475e8962860eabdcb486ebf6fdf88d4a8e5b4c42c",
      "bytes": 5303,
      "inclusion_reason": "PROJECT_CAPABILITIES.yaml required_knowledge (delivery=bundle)",
      "source_class": "governed_knowledge_bundle"
    },
    {
      "path": "ChatGPT/[AI OS]/Knowledge/SMOKE_QA_FOR_AI_OS.md",
      "canonical_owner": "ai_os",
      "purpose": "named as required behavior check in PROJECT_INSTRUCTIONS.md #2",
      "content_hash": "064c4ba716ee9e04e8b8fe7631a32c5785a3267478351d19baa8271b1c6842f8",
      "bytes": 4673,
      "inclusion_reason": "PROJECT_CAPABILITIES.yaml required_knowledge (delivery=bundle)",
      "source_class": "governed_knowledge_bundle"
    },
    {
      "path": "ChatGPT/[AI OS]/Knowledge/ANTI_PATTERNS.md",
      "canonical_owner": "ai_os",
      "purpose": "named as required behavior check in PROJECT_INSTRUCTIONS.md #2",
      "content_hash": "859195550aca36fa8aca6dcd57ec3e4e0ea5fef72ab4b419c6c932589e1e47e0",
      "bytes": 2638,
      "inclusion_reason": "PROJECT_CAPABILITIES.yaml required_knowledge (delivery=bundle)",
      "source_class": "governed_knowledge_bundle"
    },
    {
      "path": "HANDOFF_STYLE_STANDARD.md",
      "canonical_owner": "ai_os",
      "purpose": "cited for the canonical handoff field set, PROJECT_INSTRUCTIONS.md Goal Mode handoff section",
      "content_hash": "c612423c6c8010a494ab79b3619f241383d871e5f0e6a2c8ff62f9dd576a6d27",
      "bytes": 3163,
      "inclusion_reason": "PROJECT_CAPABILITIES.yaml required_knowledge (delivery=bundle)",
      "source_class": "governed_knowledge_bundle"
    }
  ],
  "rendering_rules": {
    "ordering": "declared_order_stable",
    "delimiter_style": "markdown_heading_per_source"
  },
  "model_message_structure": [
    {
      "turn": "system",
      "source_paths": [
        "ROUTING_RULES.md",
        "ChatGPT/[AI OS]/PROJECT_INSTRUCTIONS.md",
        "ChatGPT/[AI OS]/Knowledge/AI_OS_PROJECT_FILES_INDEX.md",
        "ChatGPT/[AI OS]/Knowledge/PROJECT_ROUTING.md",
        "ChatGPT/[AI OS]/Knowledge/GOVERNANCE_RULES.md",
        "ChatGPT/[AI OS]/Knowledge/AI_OS_WORKFLOW.md",
        "ChatGPT/[AI OS]/Knowledge/HANDOFF_PROTOCOL.md",
        "ChatGPT/[AI OS]/Knowledge/SMOKE_QA_FOR_AI_OS.md",
        "ChatGPT/[AI OS]/Knowledge/ANTI_PATTERNS.md",
        "HANDOFF_STYLE_STANDARD.md"
      ]
    }
  ],
  "excluded_sources": [
    {
      "path": "ChatGPT/[AI OS]/KB__00_INDEX.md",
      "reason": "delivery='external'; not a repo-tracked source (governed KB lives only in the live ChatGPT Project)"
    },
    {
      "path": "ChatGPT/[AI OS]/KB__03_WORKFLOWS_TRACEABILITY.md",
      "reason": "delivery='external'; not a repo-tracked source (governed KB lives only in the live ChatGPT Project)"
    },
    {
      "path": "ChatGPT/[AI OS]/KB__05_CANONICAL_CONCEPTS.md",
      "reason": "delivery='external'; not a repo-tracked source (governed KB lives only in the live ChatGPT Project)"
    },
    {
      "path": "ChatGPT/[AI OS]/KB__06_OPERATIONAL_FRAMEWORKS.md",
      "reason": "delivery='external'; not a repo-tracked source (governed KB lives only in the live ChatGPT Project)"
    },
    {
      "path": "ChatGPT/[AI OS]/KB__07_PATTERNS_AND_FAILURES.md",
      "reason": "delivery='external'; not a repo-tracked source (governed KB lives only in the live ChatGPT Project)"
    },
    {
      "path": "ChatGPT/[AI OS]/KB__08_USE_CASES_FOR_SERGEY.md",
      "reason": "delivery='external'; not a repo-tracked source (governed KB lives only in the live ChatGPT Project)"
    },
    {
      "path": "ChatGPT/[AI OS]/KB__USE_CASE_ROUTING.md",
      "reason": "delivery='external'; not a repo-tracked source (governed KB lives only in the live ChatGPT Project)"
    },
    {
      "path": "ChatGPT/[AI OS]/KB__CONFIDENCE_RULES.md",
      "reason": "delivery='external'; not a repo-tracked source (governed KB lives only in the live ChatGPT Project)"
    },
    {
      "path": "ChatGPT/[AI OS]/KB__REVIEW_QUEUE.md",
      "reason": "delivery='external'; not a repo-tracked source (governed KB lives only in the live ChatGPT Project)"
    },
    {
      "path": "ChatGPT/[AI OS]/KB__RELEASE_MANIFEST.md",
      "reason": "delivery='external'; not a repo-tracked source (governed KB lives only in the live ChatGPT Project)"
    }
  ],
  "forbidden_source_classes": [
    "blinded_output",
    "frozen_rubric",
    "failure_registry_entry"
  ],
  "context_hash": "8119242510d2b3497bede37c09aa0715ef22f8b722d8465afdbf6e5244f04509",
  "created_by_version": "autoresearch_context_pack_compiler/0.3.0",
  "fidelity_mode": "repo_replay",
  "limitations": "This context is a reproducible repository-derived replay of AI-OS instructions and governed sources. It is not evidence of exact equivalence to proprietary ChatGPT Project runtime assembly unless separately validated.",
  "mutable_surface_excerpt": {
    "path": "ChatGPT/[AI OS]/PROJECT_INSTRUCTIONS.md",
    "surface_id": "MUT-AIOS-CONTEXT-PRIORITY",
    "anchor": "## 2. Индексы и источники",
    "excerpt_text": "## 2. Индексы и источники\n\nЕсть два индекса:\n- `KB__00_INDEX.md` — индекс governed KB: знания, концепции, паттерны, workflows, evidence.\n- `AI_OS_PROJECT_FILES_INDEX.md` — индекс рабочих настроек: routing, usage rules, handoff, smoke QA.\n\nДля знаний и фактов сначала используй KB-файлы. Для поведения проекта и формата ответа используй рабочие файлы. Если конфликт: KB governance выше project settings. При конфликте между `PROJECT_ROUTING.md` и `GOVERNANCE_RULES.md` приоритет у `GOVERNANCE_RULES.md`.\n\nПриоритет проверки KB:\n1. `KB__08_USE_CASES_FOR_SERGEY.md`\n2. `KB__07_PATTERNS_AND_FAILURES.md`\n3. `KB__06_OPERATIONAL_FRAMEWORKS.md`\n4. `KB__05_CANONICAL_CONCEPTS.md`\n5. `KB__03_WORKFLOWS_TRACEABILITY.md`\n6. `KB__USE_CASE_ROUTING.md`\n7. `KB__CONFIDENCE_RULES.md`\n8. `KB__REVIEW_QUEUE.md`\n9. `KB__RELEASE_MANIFEST.md`\n10. `KB__00_INDEX.md`\n\nДля поведения проекта также проверяй:\n`PROJECT_ROUTING.md`, `GOVERNANCE_RULES.md`, `AI_OS_WORKFLOW.md`, `HANDOFF_PROTOCOL.md`, `SMOKE_QA_FOR_AI_OS.md`.\n\nЕсли вопрос касается текущего статуса настройки проекта, сначала проверь `CURRENT_STATUS.md` и `docs/evidence/SMOKE_QA_RESULTS.md`, если они доступны. Если их нет, прямо скажи, что текущий status setup не полностью записан.\n",
    "excerpt_hash": "1efa69b2288e1dd41884685ef70e4837322f9240b458d0ea474a56a8f1f21628"
  }
}
